{
  "schema_version": "1.0.0",
  "generated_at": "2026-06-15T11:28:25Z",
  "source": "api_endpoint_configs",
  "base_url": "https://v3-api.texau.com/api/v1",
  "auth": {
    "type": "api_key",
    "header": "x-api-key"
  },
  "endpoints": [
    {
      "name": "sleep_test",
      "display_name": "Sleep Test",
      "description": "Sleep for N seconds (default 60) and return the elapsed time. Useful for testing client timeouts and async polling loops.",
      "category": null,
      "doc_section": null,
      "method": "POST",
      "path": "/sleep_test",
      "visibility": "public",
      "input_schema": {
        "type": "object",
        "required": [],
        "properties": {
          "seconds": {
            "type": "integer",
            "description": "Seconds to sleep (1-300, default 60)"
          }
        }
      },
      "output_schema": [
        {
          "type": "integer",
          "field": "requested_seconds",
          "description": "Requested sleep duration in seconds"
        },
        {
          "type": "number",
          "field": "slept_seconds",
          "description": "Actual elapsed wall-clock time in seconds"
        }
      ],
      "path_params": [],
      "query_params": [],
      "default_query": {},
      "default_body": {},
      "example_body": {
        "seconds": 60
      },
      "pricing": {
        "credits_per_call": 0.5
      },
      "async": {
        "enabled": false,
        "required_polling": false,
        "mode": "sync"
      },
      "polling": null,
      "webhook": null,
      "integrations": {
        "n8n": {
          "enabled": true,
          "operation_name": "sleep_test"
        },
        "mcp": {
          "enabled": true,
          "tool_name": "richapi_sleep_test"
        },
        "openapi": {
          "enabled": true
        }
      }
    },
    {
      "name": "ai_enrich",
      "display_name": "AI Enrich",
      "description": "Enrich, classify, extract, or summarize text using OpenAI, Anthropic, Gemini, or Perplexity.",
      "category": "AI",
      "doc_section": "ai",
      "method": "POST",
      "path": "/ai_enrich",
      "visibility": "public",
      "input_schema": {
        "type": "object",
        "required": [
          "provider",
          "prompt"
        ],
        "properties": {
          "model": {
            "type": "string",
            "description": "Model override (e.g. gpt-4o); defaults to provider default"
          },
          "prompt": {
            "type": "string",
            "description": "Prompt template; use {{fieldName}} placeholders for dynamic values"
          },
          "context": {
            "type": "object",
            "description": "Key-value pairs for template substitution in the prompt"
          },
          "provider": {
            "type": "string",
            "description": "AI provider: openai, anthropic, gemini, or perplexity"
          },
          "max_tokens": {
            "type": "integer",
            "description": "Maximum output tokens (default 4096)"
          },
          "output_type": {
            "type": "string",
            "description": "Output format: text or json (json forces structured output)"
          },
          "temperature": {
            "type": "number",
            "description": "Sampling temperature (0-1, default 0)"
          },
          "output_schema": {
            "type": "object",
            "description": "JSON schema to guide structured output (when output_type is json)"
          },
          "system_prompt": {
            "type": "string",
            "description": "System prompt / instructions for the model"
          },
          "use_web_search": {
            "type": "boolean",
            "description": "Enable web search (supported by OpenAI, Anthropic, Gemini, Perplexity)"
          },
          "search_domain_filter": {
            "type": "array",
            "description": "Perplexity only \u2014 limit search to specific domains"
          },
          "search_recency_filter": {
            "type": "string",
            "description": "Perplexity only \u2014 filter by recency: day, week, month, year"
          }
        }
      },
      "output_schema": [
        {
          "type": "string",
          "field": "result",
          "description": "AI-generated output text"
        },
        {
          "type": "string",
          "field": "model",
          "description": "Model that was used"
        },
        {
          "type": "string",
          "field": "provider",
          "description": "Provider that was used"
        },
        {
          "type": "object",
          "field": "usage",
          "description": "Token usage (promptTokens, completionTokens, totalTokens)"
        }
      ],
      "path_params": [],
      "query_params": [],
      "default_query": {},
      "default_body": {},
      "example_body": {
        "prompt": "Summarise this: {{text}}",
        "context": {
          "text": "TexAu automates outreach."
        },
        "provider": "openai",
        "output_type": "text"
      },
      "pricing": {
        "credits_per_call": 2
      },
      "async": {
        "enabled": false,
        "required_polling": false,
        "mode": "sync"
      },
      "polling": null,
      "webhook": null,
      "integrations": {
        "n8n": {
          "enabled": true,
          "operation_name": "ai_enrich"
        },
        "mcp": {
          "enabled": true,
          "tool_name": "richapi_ai_enrich"
        },
        "openapi": {
          "enabled": true
        }
      }
    },
    {
      "name": "post_activities",
      "display_name": "Post Activities",
      "description": "Get likes, comments and reactions on a specific LinkedIn post.",
      "category": "Activity",
      "doc_section": "activity",
      "method": "POST",
      "path": "/post_activities",
      "visibility": "public",
      "input_schema": {
        "type": "object",
        "required": [
          "urn"
        ],
        "properties": {
          "urn": {
            "type": "string",
            "description": "LinkedIn activity URN (e.g. urn:li:activity:7458532524865232896)"
          }
        }
      },
      "output_schema": [
        {
          "type": "string",
          "field": "urn",
          "description": "LinkedIn activity URN (e.g. urn:li:activity:...)"
        },
        {
          "type": "string",
          "field": "commentary",
          "description": "Post text content"
        },
        {
          "type": "integer",
          "field": "numComments",
          "description": "Total number of comments"
        },
        {
          "type": "integer",
          "field": "numReactions",
          "description": "Total number of reactions"
        },
        {
          "type": "object",
          "field": "reactionType",
          "description": "Reaction counts by type (e.g. {like: 91, praise: 4})"
        },
        {
          "type": "string",
          "field": "shareUrl",
          "description": "Public URL to the LinkedIn post"
        },
        {
          "type": "object",
          "field": "actor",
          "description": "Post author: profileId, firstName, lastName, headline, profilePicture"
        },
        {
          "type": "array",
          "field": "comments",
          "description": "Comment list. Each: id, comment, totalComments, totalReactions, url, commenter"
        },
        {
          "type": "array",
          "field": "reactions",
          "description": "Reaction list. Each: reaction (LIKE/PRAISE/etc.), reactor profile"
        },
        {
          "type": "object",
          "field": "content",
          "description": "Attached content: image, video, article, document, poll (null when absent)"
        },
        {
          "type": "boolean",
          "field": "sponsored",
          "description": "Whether the post is sponsored"
        }
      ],
      "path_params": [],
      "query_params": [],
      "default_query": {},
      "default_body": {
        "useCache": true
      },
      "example_body": {
        "urn": "urn:li:activity:7458532524865232896"
      },
      "pricing": {
        "credits_per_call": 3
      },
      "async": {
        "enabled": false,
        "required_polling": false,
        "mode": "sync"
      },
      "polling": null,
      "webhook": null,
      "integrations": {
        "n8n": {
          "enabled": true,
          "operation_name": "post_activities"
        },
        "mcp": {
          "enabled": true,
          "tool_name": "richapi_post_activities"
        },
        "openapi": {
          "enabled": true
        }
      }
    },
    {
      "name": "post_details",
      "display_name": "Post Details",
      "description": "Get full post details including text, media, comments and reaction counts.",
      "category": "Activity",
      "doc_section": "activity",
      "method": "POST",
      "path": "/post_details",
      "visibility": "public",
      "input_schema": {
        "type": "object",
        "required": [
          "urn"
        ],
        "properties": {
          "urn": {
            "type": "string",
            "description": "LinkedIn activity URN (e.g. urn:li:activity:7458532524865232896)"
          },
          "comments": {
            "type": "boolean",
            "description": "Include comments in the response (default true)"
          },
          "reactions": {
            "type": "boolean",
            "description": "Include reactions in the response (default true)"
          }
        }
      },
      "output_schema": [
        {
          "type": "string",
          "field": "urn",
          "description": "LinkedIn activity URN (e.g. urn:li:activity:...)"
        },
        {
          "type": "string",
          "field": "threadUrn",
          "description": "LinkedIn ugcPost URN of the thread"
        },
        {
          "type": "string",
          "field": "shareUrn",